{
  "schema": "cost02-model-input-v1",
  "pricingFile": "cost02-prices.json",
  "durationDays": 30,
  "assumptions": {
    "exampleOnly": true,
    "description": "Deterministic hand example, not a measured Patternly flow or a forecast. 1,000 DAU × 1.5 sessions/day × 30 days; one HTTP request and four billable-read-estimate units per session.",
    "sessionServiceTimeMs": 400,
    "httpServiceTimeBasis": "app backend only; milliseconds summed over measured app HTTP requests"
  },
  "flowObservations": [
    {
      "id": "hand-session-example",
      "event": "session",
      "audience": "both",
      "cloudRunServiceTimeMsAssumption": 100,
      "sampleCount": 1,
      "requests": 1,
      "firestoreReadsObserved": 3,
      "firestoreReadsBillableEstimate": 4,
      "missingPointReads": 1,
      "queryCount": 1,
      "emptyQueryCount": 0,
      "indexEntryReads": "NOT_MEASURED",
      "firestoreWrites": 0,
      "firestoreDeletes": 0,
      "responseBytes": 256,
      "requestBytes": 32,
      "gcsDownloads": 0,
      "gcsDownloadBytes": 0,
      "httpServiceTimeMsSum": 400,
      "httpServiceTimeMsMax": 400,
      "evidenceRef": "EXAMPLE ONLY: hand-calculation input, not collected evidence"
    }
  ],
  "profiles": [
    {
      "name": "example-1000-moderate",
      "kind": "moderate",
      "flowIds": ["hand-session-example"],
      "packageDelivery": "none",
      "dau": 1000,
      "accountShare": 0.8,
      "sessionsPerDauDay": 1.5,
      "sessionDurationMinutes": 20,
      "foregroundReturnsPerSession": 0,
      "answersPerSession": 0,
      "completionsPerDauDay": 0,
      "premiumRefreshesPerSession": 0,
      "reconnectsPerDauDay": 0,
      "historyPagesPerSession": 0,
      "monthlyActiveAccounts": 800,
      "retryAttemptsPerRequest": 0,
      "packageDownloadsPerAccountMonth": 0,
      "packageBytes": 0,
      "retainedPackageGiB": 0,
      "historyAccountsStored": 800,
      "historyRecordsPerAccountAtStart": 0,
      "historyRecordBytes": 0,
      "historyRecordsAddedPerAccountMonth": 0,
      "historyRetentionDays": 30,
      "pitrGiB": 0,
      "activeWindowHoursPerDay": 8,
      "min0ColdStartsPerDay": 1,
      "min1ColdStartsPerDay": 1,
      "startupMs": 1000,
      "shutdownMs": 1000,
      "extraCpuBoostMsPerStart": 1000,
      "cpuBoostMultiplier": 2,
      "concurrency": 80,
      "cpuVcpu": 1,
      "memoryGiB": 0.5
    }
  ],
  "sharedUsage": {
    "applyFirestoreDailyFreeQuota": false,
    "firestoreReadsIncludedDaily": 50000,
    "firestoreWritesIncludedDaily": 20000,
    "firestoreDeletesIncludedDaily": 20000,
    "artifactRegistryStoredGiB": 0,
    "secretManagerActiveVersions": 0,
    "secretManagerAccesses": 0
  }
}
